title,description,keywords,concept,contentType
"صباح هادئ - فن القهوة","مشهد سينمائي للقهوة الصباحية والتأمل. شمس غروب ذهبية تخترق نافذة مستطيلة على كوب قهوة بخار متراقص","mindfulness,morning ritual,slow living,coffee preparation,aesthetic,peaceful,golden hour,window light,minimalist",طقوس صباحية,video
"الطبخ التقليدي - الخبز الحرفي","وثائقي قصير عن فن صنع الخبز التقليدي باليد. مقربة على العجين والخبازين المهرة","traditional cooking,heritage recipe,artisan bread,baking,hands-on,craftsmanship,slow food",صنع الخبز,video
"اليوغا في الطبيعة - شروق الشمس","جلسة يوغا هادئة على شاطئ بحري عند شروق الشمس. تمارين تمدد وتنفس عميق","wellness,yoga,sunrise,beach,mindfulness,flexibility,meditation,stretching",تمارين الصحة,video
"المقهى الريفي - الهدوء يتحدث","مقهى صغير بسيط في القرية. أشخاص يستمتعون بالقهوة والحوار. أجواء دافئة وهادئة","coffee shop,rural village,quiet moments,social gathering,simple living,conversation,authenticity",الحياة البسيطة,video
"الحديقة الحضرية - الخضراء والإسمنت","تحويل سطح بناية خرسانية إلى حديقة خضراء. من الإسمنت الرمادي إلى النباتات الخضراء","urban gardening,sustainability,green space,concrete to green,eco-friendly,transformation,community",تحسين الحضر,video
"الصباح مع النوارس - الشاطئ الفارغ","شاطئ هادئ عند الفجر. نوارس تحلق والموجات تصطدم أرضاً. لا أشخاص، فقط الطبيعة","dawn,beach,seagulls,waves,solitude,peaceful,nature,coastal,golden light",واحات طبيعية,video
"الرحل الحديث - حياة على الطريق","سفاري وفي الطريق. خيمات وسيارات ومغامرات. الحياة خارج التقليدي","digital nomad,van life,outdoor,adventure,freedom,wanderlust,travel,minimalism",الحياة الحرة,video
"النسيج اليدوي - قصة الخيوط","امرأة عجوز تنسج على نول تقليدي. خيوط ملونة وحركات دقيقة. فن قديم حي","traditional weaving,handicraft,textile,loom,hands,artistry,cultural heritage,slow craft",الحرف التقليدية,video
"الزراعة العضوية - من البذرة للمحصول","حديقة عضوية صغيرة. البذر والنمو والحصاد. بدون مبيدات كيميائية","organic farming,sustainable agriculture,vegetable garden,eco-friendly,natural growing,harvest,permaculture",الزراعة المستدامة,video
"الموسيقى الحية - الشارع والعازف","عازف قيثارة جالس في منتصف الشارع يعزف موسيقى كلاسيكية. الناس يستمعون ويستريحون","street musician,live music,acoustic guitar,classical,busking,outdoor performance,melody",الفن في الشارع,video
"القراءة في الحديقة - كتاب والطبيعة","شخص مسترخ يقرأ كتاباً في حديقة هادئة. شجر أخضر ونسيم رطب وهدوء","reading,books,nature,park,relaxation,quiet time,knowledge,garden,peaceful",هوايات الهدوء,video
"المطبخ الصغير - الطهي الإبداعي","مطبخ صغير في شقة صغيرة. طاهي منزلي يبتكر وصفة جديدة مع مكونات بسيطة","home cooking,small space,creativity,budget-friendly,simplicity,culinary art,comfort food",الطهي المنزلي,video
"الشاي - الطقس والسلام","مراسم تحضير الشاي بعناية فائقة. أدوات خاصة وماء ساخن وأوراق شاي منتقاة","tea ceremony,mindfulness,ritual,peaceful,traditional,beverage,culture,meditative",طقوس الشاي,video
"الضاحية الهادئة - حياة الضواحي","حي سكني صغير هادئ. منازل بسيطة وحدائق وأطفال يلعبون بأمان","suburban life,peaceful neighborhood,residential,simple living,community,safe,quiet streets",حياة الضاحية,video
"الفن في الجدران - الجرافيتي الفني","فنان رسام جرافيتي يرسم لوحة فنية على جدار خرساني. ألوان زاهية وإبداع","street art,graffiti,urban,creative expression,colors,mural,artistic,vandalism-free",الفن الحضري,video
"الطفل والطبيعة - الاستكشاف","طفل صغير يستكشف الطبيعة. يمسك الحشرات والأوراق والأحجار. فضول وفرح","childhood,nature exploration,wonder,discovery,learning,outdoor play,curiosity",براءة الطفولة,video
"الشيخوخة الجميلة - الحياة المعاشة","صور قريبة لوجوه كبار السن. تجاعيد تحكي القصص. أعينهم تضيء بالحكمة","aging,wisdom,elderly,lived life,beauty in age,experience,portraits,respect",كرامة السن,video
"التأمل - الهدوء الداخلي","شخص جالس في وضعية تأمل. عينا مغمضتان والنفس هادئ. سلام داخلي","meditation,mindfulness,inner peace,spirituality,breathing,calmness,zen,serenity",الروحانية,video
"الماء الحي - الشلالات","شلال قوي ينهمر من الصخور. رذاذ وحركة وقوة الطبيعة","waterfall,flowing,nature,power,fresh water,wilderness,cascade,beauty",قوى الطبيعة,video
"النار الموقد - الدفء العائلي","عائلة جالسة حول موقد نار. الدفء والألفة والحكايات","family,fireplace,warmth,togetherness,stories,hearth,tradition",الألفة العائلية,video
"السماء النجمية - اللامنهاية","سماء ليلية مليئة بالنجوم. غالاكسي الحليب واضحة جداً. تأمل في الكون","night sky,stars,galaxy,infinite,universe,astronomy,wonder,cosmos",روعة الفضاء,video
"الثراء الثقافي - الحفلات التقليدية","حفل تقليدي شعبي. رقص وألبسة ملونة وموسيقى تراثية","cultural festival,traditional,celebration,dance,music,heritage,community gathering",التراث الشعبي,video
"الصحة النفسية - الدعم والمحبة","مجموعة أصدقاء يتحدثون عن مشاعرهم بصراحة. الدعم والحب","mental health,support,friendship,emotional,sharing,love,counseling",الصحة النفسية,video
"الابتكار الأخضر - التكنولوجيا والبيئة","مختبر تطوير تكنولوجيات صديقة للبيئة. ألواح شمسية وطاقة نظيفة","green technology,innovation,solar,renewable energy,sustainability,eco-tech",الطاقة النظيفة,video
"الأطفال يلعبون - الفرح البريء","مجموعة أطفال يلعبون لعباً حرة بدون ألعاب كهربائية. ضحكات وحركة","children playing,outdoor play,joy,innocent fun,games,laughter,playfulness",متعة الطفل,video
"الحيوانات المنزلية - الحب اللامشروط","رجل يعتني بحيوانه الأليف. لحلقات هادئة وحب غير مشروط","pets,animals,love,care,unconditional affection,companionship,loyalty",الحنان الحيواني,video
"الفصول الأربعة - التدوير","طبيعة في جميع الفصول الأربعة. انتقال سلس من الربيع للشتاء","seasons,spring,summer,autumn,winter,cycle,nature,transition",دورة الطبيعة,video
"الألوان - النظر بعمق","لقطات قريبة جداً للألوان. زهرة حمراء وسماء زرقاء وأوراق خضراء","colors,macro,close-up,vibrant,botanical,nature,photography",قوة الألوان,video
"الموسيقى الهادئة - التأثير العاطفي","موسيقى هادئة تعزف وتظهر على الشاشة النوتة الموسيقية","soft music,emotional,melody,classical,instrumental,soothing,feelings",الموسيقى الحزينة,video
"الحرية - الطيور والسماء","طيور تحلق بحرية في السماء الواسعة. حرية الحركة والاستقلالية","freedom,birds,flying,sky,independence,liberty,open space",الحرية الحقيقية,video
